{
  "$schema": "https://json-schema.org/draft/2020-12/schema",
  "$id": "https://nixpt.dev/mayfly/schemas/task.schema.json",
  "title": "MayflyTask",
  "type": "object",
  "additionalProperties": false,
  "required": [
    "task",
    "done_when",
    "harness"
  ],
  "properties": {
    "task": {
      "type": "string",
      "minLength": 8,
      "maxLength": 500,
      "description": "Single concrete purpose. No open-ended polish verbs."
    },
    "done_when": {
      "oneOf": [
        {
          "type": "object",
          "required": [
            "type",
            "run"
          ],
          "additionalProperties": false,
          "properties": {
            "type": {
              "const": "command"
            },
            "run": {
              "type": "string",
              "minLength": 1
            },
            "expect_exit": {
              "type": "integer",
              "default": 0
            }
          }
        },
        {
          "type": "object",
          "required": [
            "type",
            "paths"
          ],
          "additionalProperties": false,
          "properties": {
            "type": {
              "const": "files_exist"
            },
            "paths": {
              "type": "array",
              "items": {
                "type": "string"
              },
              "minItems": 1
            }
          }
        }
      ]
    },
    "harness": {
      "type": "string",
      "enum": [
        "claude",
        "ccf",
        "cursor",
        "codex",
        "cxf",
        "cece",
        "opencode",
        "copilot",
        "exec"
      ]
    },
    "cwd": {
      "type": "string",
      "default": "."
    },
    "ttl": {
      "type": "string",
      "pattern": "^[0-9]+(s|m|h)$",
      "default": "15m",
      "description": "Hard lifespan. Max 2h."
    },
    "budget": {
      "type": "object",
      "additionalProperties": false,
      "properties": {
        "max_turns": {
          "type": "integer",
          "minimum": 1
        },
        "max_usd": {
          "type": "number",
          "minimum": 0
        }
      }
    },
    "aging": {
      "type": "object",
      "additionalProperties": false,
      "properties": {
        "warn_at": {
          "type": "number",
          "minimum": 0,
          "maximum": 1,
          "default": 0.5
        },
        "narrow_at": {
          "type": "number",
          "minimum": 0,
          "maximum": 1,
          "default": 0.75
        }
      }
    },
    "artifacts": {
      "type": "array",
      "items": {
        "type": "string",
        "enum": [
          "diff",
          "log",
          "stdout"
        ]
      },
      "default": [
        "diff",
        "log"
      ]
    },
    "constraints": {
      "type": "object",
      "additionalProperties": false,
      "properties": {
        "no_spawn": {
          "type": "boolean",
          "default": true
        },
        "no_commit_to": {
          "type": "array",
          "items": {
            "type": "string"
          },
          "default": [
            "main",
            "master",
            "dev"
          ]
        },
        "paths_allow": {
          "type": "array",
          "items": {
            "type": "string"
          }
        }
      }
    },
    "model": {
      "type": "string",
      "description": "Model for the harness: claude/ccf --model, codex/cxf -m, opencode -m, copilot --model. Other harnesses refuse the task."
    },
    "read_only": {
      "type": "boolean",
      "default": false,
      "description": "Enforced read-only hatch: claude/ccf run with --tools Read,Grep,Glob --permission-mode dontAsk --strict-mcp-config (no skip-permissions); codex/cxf with --sandbox read-only; copilot with --deny-tool write/shell/url --disable-builtin-mcps. Other harnesses refuse the task. The agent cannot write files, so done_when must not require writes. Incompatible with tools."
    },
    "tools": {
      "type": "array",
      "items": {
        "type": "string",
        "minLength": 1
      },
      "description": "Claude Code tool / permission-rule allowlist (MAYFLY-11). When set, claude/ccf use --tools <builtins> --allowedTools <all> --permission-mode dontAsk --strict-mcp-config and never --dangerously-skip-permissions. copilot translates Bash(cmd[:*]) → shell(...), Edit(//abs or /project-relative file) → write(/abs), bare Read/Grep/Glob/LS → no rule, and refuses globs, scoped reads and MCP tools (it has no mcp_servers). Incompatible with read_only. Other harnesses refuse."
    },
    "mcp_servers": {
      "type": "array",
      "items": {
        "type": "string",
        "minLength": 1
      },
      "description": "MCP server names from the user's ~/.claude.json mcpServers (MAYFLY-11). Requires tools. Resolved into a hatch-local 0600 --mcp-config (deleted at teardown). Unknown names fail validate. Other harnesses refuse."
    }
  }
}
