{
  "task": "Survey open PRs and their CI for nixpt/mayfly, nixpt/squadmail and nixpt/buckets. Run exactly one gh command per tool call, with nothing else in it (no loops, pipes, &&, ;, redirects, echo or mkdir): `gh pr list -R nixpt/<repo> --state open --json number,title,headRefName,statusCheckRollup --limit 50` for each repo. The directory /build/tmp/mayfly already exists. Write /build/tmp/mayfly/pr-survey.md: per repo, a table of number, title, branch, checks summary (or 'no checks').",
  "done_when": {
    "type": "files_exist",
    "paths": [
      "/build/tmp/mayfly/pr-survey.md"
    ]
  },
  "harness": "claude",
  "model": "haiku",
  "cwd": ".",
  "ttl": "10m",
  "budget": {
    "max_usd": 0.5
  },
  "tools": [
    "Bash(gh pr list:*)",
    "Bash(gh pr view:*)",
    "Bash(gh pr checks:*)",
    "Edit(//build/tmp/mayfly/pr-survey.md)"
  ],
  "constraints": {
    "no_spawn": true,
    "no_commit_to": [
      "main",
      "master",
      "dev"
    ]
  }
}
